{
  "schemaVersion": "1.0.0",
  "packageVersion": "26.7.27",
  "assessmentId": "assessment-synthetic-goal-001",
  "assetId": "asset-assessment-synthetic-goal",
  "revision": 1,
  "previousRevisionRef": null,
  "createdAt": "2026-07-27T00:00:00+08:00",
  "updatedAt": "2026-07-27T00:00:00+08:00",
  "asOf": "2026-07-27T00:00:00+08:00",
  "taskContextId": "task-context-park-synthetic-demo",
  "parkId": "park-synthetic-demo",
  "contextHash": "23d51bf7b3a6c78cd39089afff1a07b6a1cb7c21a45fb26d537db20d54001859",
  "taskGoalRef": "examples/park-brief.example.json#/taskGoal",
  "taskGoalHash": "d0dd46edd75b98a8e6b318f5a31832b7c8b6cf5e4e9f40e19d4f458df8770392",
  "taskState": "in_progress",
  "evaluationScopeAssessment": {
    "scopeMode": "open",
    "scopeRef": "examples/park-brief.example.json#/taskGoal/searchScope",
    "status": "incomplete",
    "evidenceRefs": [],
    "basisRefs": [
      "examples/park-brief.example.json#/inputReceipts/0"
    ]
  },
  "deliverableRequirementAssessments": [],
  "workItemCounts": [
    {
      "sampleUnit": "deliverable",
      "observed": 0,
      "assessed": 0,
      "accepted": 0,
      "delivered": 0,
      "unresolved": 0
    }
  ],
  "unmetRequirementRefs": [],
  "visibleDeliveryReceiptRefs": [],
  "terminalProof": null,
  "pauseReason": null,
  "nextCursor": "goal-synthetic-five:task-assessment:not-started",
  "continuationRequirements": [
    "当前冻结目标未声明独立交付物要求；本记录只表示尚未形成可完成的任务评估，不代表已交付。"
  ],
  "nextActions": [],
  "nextAction": null,
  "assessmentHash": "91e764e4fd09364a9d21be76170b3835c39e0d7a7fab386811c00722bf27e87d"
}
